{
  "schemaVersion": "1.0",
  "tag": "2.7.41491.1225AMD64&ARM64",
  "releaseName": "Windows IaaS VMAgent 2.7.41491.1225 AMD64&ARM64 [Cancelled At Stage 9]",
  "prerelease": false,
  "publishedAt": "2026-05-18T20:11:39Z",
  "generatedAt": "2026-07-14T21:47:50Z",
  "model": "claude-opus-4.8",
  "previousTag": "2.7.41491.1216AMD64&ARM64",
  "overallRisk": "High",
  "summary": "Binary-level analysis of the amd64 and arm64 GuestAgentPackage .zip assets of VMAgent 2.7.41491.1225 (baseline 2.7.41491.1216); the .wim, .msi and _PDBs.zip assets were intentionally excluded per scope. The amd64 package contains 110 PE files (43 managed, 67 native) and the arm64 package 64 PE files (40 managed, 24 native); every binary is validly Microsoft-signed (leaf CN=Microsoft Corporation), SHA-256 file digest, RFC-3161 timestamped. Two findings drive risk. (1) Rust supportability (High): the native Rust modules rust_common.dll and rust_utils.dll are built with Microsoft rustc 1.92.0 and 1.84.1 respectively (both >= 1.78) and import Windows 8+/Server 2012+ only APIs (WaitOnAddress via api-ms-win-core-synch-l1-2-0.dll, GetSystemTimePreciseAsFileTime), so they cannot load on the agent's oldest declared OS, Windows 7 SP2 / Windows Server 2008 SP2. This condition is pre-existing and identical in the 2.7.41491.1216 baseline (same rustc versions and same imports) rather than a regression introduced by this release. (2) Signing-certificate change (Medium): the code-signing chain rotated from issuing CA 'Microsoft Code Signing PCA 2011' (baseline) to 'Microsoft Code Signing PCA 2024' (this release); the leaf subject is unchanged and both chain to Microsoft Root Certificate Authority 2011 - a benign Microsoft PKI rotation, not a compromise. All managed assemblies still target .NET Framework 4.0 (CLR v4.0.30319; the only exception, the third-party srmlib.dll, targets the legacy CLR v2.0 and is unchanged from baseline) - no .NET drift. Diff vs baseline: one new binary, WindowsAzureGuestAgentGateKeeper.exe (matches the 'pre-validation gate keeper' change-list items), nothing removed, and nearly all binaries re-signed/rebuilt (hash change) consistent with the stated build-image 2019->2022 move plus the certificate rotation. Net release-specific delta is low; overall rating is High solely because of the (carried-over) Rust down-level supportability gap.",
  "findings": [
    {
      "category": "Rust supportability",
      "severity": "High",
      "finding": "Shipped Rust binaries built with rustc >= 1.78 and import Windows 8+ only synchronization APIs",
      "rationale": "rust_common.dll embeds the Microsoft toolchain path 'rust.tools.stable-llvm-x86_64-pc-windows-msvc.1.92.0-ms-20260416.4' (rustc 1.92.0) and rust_utils.dll embeds 'rust.tools-x86_64-pc-windows-msvc 1.84.1-ms-20250131.1' (rustc 1.84.1); both are >= 1.78, at which point the Rust project made Windows 10 / Server 2016 the minimum supported Windows version. This is confirmed at the binary level: both modules import WaitOnAddress from api-ms-win-core-synch-l1-2-0.dll and rust_common.dll also imports GetSystemTimePreciseAsFileTime - APIs that do not exist on Windows 7 SP2 / Windows Server 2008 SP2, so these modules cannot load there. The identical rustc versions and identical imports are present in the 2.7.41491.1216 baseline, so this is a pre-existing supportability gap, not a regression in 2.7.41491.1225.",
      "recommendation": "Confirm whether Windows 7 SP2 / Windows Server 2008 SP2 are still officially supported for the Rust-backed code paths (catalog-file feature). If down-level support is required, pin the Rust components to a toolchain < 1.78 or gate the Rust code paths off on those OSes; otherwise update the documented minimum OS to Windows 10 / Server 2016 for functionality that depends on rust_common.dll / rust_utils.dll.",
      "evidenceRefs": [
        "cur/amd64_x/rust_common.dll: rustc 1.92.0-ms-20260416.4",
        "cur/amd64_x/rust_utils.dll: rustc 1.84.1-ms-20250131.1",
        "cur/amd64_x/rust_common.dll import: WaitOnAddress (api-ms-win-core-synch-l1-2-0.dll), GetSystemTimePreciseAsFileTime",
        "cur/arm64_x/rust_common.dll: rustc 1.92.0-ms-20260416.4",
        "baseline base/amd64_x/rust_common.dll: rustc 1.92.0-ms-20260401.3 (same major.minor.patch, same WaitOnAddress import)"
      ]
    },
    {
      "category": "Signing/certificate change",
      "severity": "Medium",
      "finding": "Code-signing chain rotated from 'Microsoft Code Signing PCA 2011' to 'Microsoft Code Signing PCA 2024'",
      "rationale": "The leaf signing certificate subject is unchanged (CN=Microsoft Corporation, O=Microsoft Corporation), but its issuing intermediate CA changed from 'Microsoft Code Signing PCA 2011' in the 2.7.41491.1216 baseline (e.g. WindowsAzureGuestAgent.exe leaf thumbprint 3f56a45111684d454e231cfdc4da5c8d370f9816) to 'Microsoft Code Signing PCA 2024' in this release (leaf thumbprint 1d77a9b9e8fe2075d9ad15123257fb90db0da4a1). Both chains still root to 'Microsoft Root Certificate Authority 2011'. Every one of the 110 amd64 / 64 arm64 PE files is validly signed with a SHA-256 file digest and is RFC-3161 timestamped; no unsigned or broken-signature binaries were found. This is a routine Microsoft PKI rotation, not a certificate compromise.",
      "recommendation": "Confirm the 'Microsoft Code Signing PCA 2024' intermediate is expected and trusted by any pinning/allow-list logic in downstream validators, then treat the change as benign.",
      "evidenceRefs": [
        "cur/amd64_x/WindowsAzureGuestAgent.exe leaf issuer: CN=Microsoft Code Signing PCA 2024",
        "base/amd64_x/WindowsAzureGuestAgent.exe leaf issuer: CN=Microsoft Code Signing PCA 2011",
        "cur leaf thumbprint 1d77a9b9e8fe2075d9ad15123257fb90db0da4a1 vs base 3f56a45111684d454e231cfdc4da5c8d370f9816",
        "both chain to CN=Microsoft Root Certificate Authority 2011"
      ]
    },
    {
      "category": "Binary/dependency changes",
      "severity": "Low",
      "finding": "One new binary (WindowsAzureGuestAgentGateKeeper.exe); nearly all binaries rebuilt/re-signed",
      "rationale": "Release-to-release diff of the amd64 package shows exactly one added binary, WindowsAzureGuestAgentGateKeeper.exe (also added on arm64), which correlates with the change-list items 'pre-validation gate keeper setup' (PR 15070959) and 'gate keeper process executor' (PR 15299842). No binaries were removed. 109/110 amd64 and 63/64 arm64 shared PE files changed SHA-256, consistent with a full rebuild under the new build image (PR 15539952 '2019 to 2022') plus the certificate rotation, rather than targeted code changes. The change list also records shared-component bumps VMAgent-Shared 3.0.03312.64 -> 3.0.3355.67 and HostGAP-SDK 1.0.8.181 -> 1.0.8.184.",
      "recommendation": "No action; the new gate-keeper executable is expected. Spot-check WindowsAzureGuestAgentGateKeeper.exe is signed and targets .NET Framework 4.0 (verified: signed, .NETFramework v4.0).",
      "evidenceRefs": [
        "diff cur/amd64_x vs base/amd64_x: added WindowsAzureGuestAgentGateKeeper.exe; removed none; 109 changed",
        "change-list: PR 15070959, PR 15299842 (gate keeper)"
      ]
    },
    {
      "category": ".NET Framework 4.0",
      "severity": "Low",
      "finding": "All managed assemblies remain on .NET Framework 4.0; no drift to .NET Core / 5+",
      "rationale": "Of 43 managed assemblies in the amd64 package, 31 carry an explicit TargetFrameworkAttribute of '.NETFramework,Version=v4.0'; the remaining 12 have no TFM attribute but their CLR metadata header is v4.0.30319, so they load on the .NET Framework 4.0 runtime (mostly C++/CLI mixed-mode modules such as MFCM140.dll, TransparentInstaller.dll, VMAgentDisabler.dll). The single exception is the third-party srmlib.dll whose CLR header is v2.0.50727 (legacy .NET 2.0), which is unchanged from the baseline. No assembly targets .NETCoreApp or .NETStandard.",
      "recommendation": "No action required; continue to confirm no assembly moves off .NET Framework 4.0 in future releases.",
      "evidenceRefs": [
        "cur/amd64_x: 31 assemblies .NETFramework v4.0; 12 CLR v4.0.30319 without TFM attr",
        "cur/amd64_x/srmlib.dll: CLR v2.0.50727 (legacy, third-party, unchanged from baseline)"
      ]
    },
    {
      "category": "Rust components",
      "severity": "Low",
      "finding": "Rust catalog-feature components present and updated in line with the change list",
      "rationale": "The package ships native Rust modules rust_common.dll (vendoring proxy_agent_shared 1.0.39, tokio 1.49.0, hyper 1.8.1, serde_json 1.0.142) and rust_utils.dll (zip 0.6.6, zstd 5.0.2, bzip2 0.4.4, flate2 1.1.9), plus a managed wrapper Microsoft.WindowsAzure.GuestAgent.Core.IaaS.RustWrapper.dll. These correlate with the change-list Rust catalog-file items (PR 14499782 'Rust install and uninstall methods for catalog file feature', PR 14786098 'catalog support'). The rust_common.dll toolchain build suffix advanced from 20260401.3 (baseline) to 20260416.4 (this release) but the compiler version is the same 1.92.0.",
      "recommendation": "Track the vendored crate versions for known advisories in future releases; no action for this release beyond the supportability finding above.",
      "evidenceRefs": [
        "cur/amd64_x/rust_common.dll: proxy_agent_shared-1.0.39, tokio-1.49.0, hyper-1.8.1",
        "cur/amd64_x/rust_utils.dll: zip-0.6.6, zstd-safe-5.0.2, bzip2-0.4.4, flate2-1.1.9"
      ]
    },
    {
      "category": "OS compatibility",
      "severity": "Info",
      "finding": "Non-Rust runtime imports satisfied by in-package redistributables",